{
  "command": "/analyze-system",
  "status": "completed",
  "phase": "report",
  "goal": "Assess Apple native integration readiness for a future NetworkExtension VPN lane",
  "scope": [
    "ios/"
  ],
  "runtime_lanes": [
    "ios",
    "networkextension",
    "concurrency"
  ],
  "plan_steps": [
    "Inspect current iOS project structure",
    "Check for entitlements and extension-capable boundaries",
    "Report gaps and recommended sequence"
  ],
  "touched_files": [],
  "verification": [
    {
      "name": "Structure inspection",
      "result": "pass",
      "evidence": "iOS shell present; no active NetworkExtension target found"
    }
  ],
  "blockers": [],
  "updated_at": "2026-04-01T14:05:00Z"
}
